<predicciones
	xmlns:xsi="http://www.w3.org/2001/XMLSchema-instance" xsi:noNamespaceSchemaLocation="tiempo.xsd">
	<prediccion>
		<realizada>2023-03-05T10:45:21</realizada>
		<ubicacion id="03014">
			<localidad>
				<nombre>Alicante/Alacant</nombre>
				<provincia>Alacant/Alicante</provincia>
			</localidad>
		</ubicacion>
		<dias>
			<dia fecha="2023-03-05">
				<periodos>
					<periodo intervalo="00-24"></periodo>
					<periodo intervalo="00-12"></periodo>
					<periodo intervalo="12-24">
						<precipitaciones>80</precipitaciones>
						<nieve>1300</nieve>
						<cielo estado="Nuboso con lluvia escasa">44</cielo>
						<viento>
							<direccion>S</direccion>
							<velocidad>10</velocidad>
						</viento>
					</periodo>
					<periodo intervalo="00-06">
						<viento>
							<direccion>C</direccion>
							<velocidad>0</velocidad>
						</viento>
					</periodo>
					<periodo intervalo="06-12">
						<precipitaciones>0</precipitaciones>
						<cielo estado="Poco nuboso">12</cielo>
						<viento>
							<direccion>S</direccion>
							<velocidad>10</velocidad>
						</viento>
					</periodo>
					<periodo intervalo="12-18">
						<precipitaciones>0</precipitaciones>
						<cielo estado="Nuboso">14</cielo>
						<viento>
							<direccion>S</direccion>
							<velocidad>10</velocidad>
						</viento>
					</periodo>
					<periodo intervalo="18-24">
						<precipitaciones>75</precipitaciones>
						<nieve>1300</nieve>
						<cielo estado="Cubierto con lluvia escasa">46n</cielo>
						<viento>
							<direccion>C</direccion>
							<velocidad>0</velocidad>
						</viento>
					</periodo>
				</periodos>
				<datos>
					<dato valor="temperatura">
						<max>17</max>
						<min>5</min>
						<horas>
							<hora valor="06">6</hora>
							<hora valor="12">16</hora>
							<hora valor="18">14</hora>
							<hora valor="24">11</hora>
						</horas>
					</dato>
					<dato valor="sens_termica">
						<max>17</max>
						<min>5</min>
						<horas>
							<hora valor="06">6</hora>
							<hora valor="12">16</hora>
							<hora valor="18">14</hora>
							<hora valor="24">11</hora>
						</horas>
					</dato>
					<dato valor="humedad_relativa">
						<max>80</max>
						<min>40</min>
						<horas>
							<hora valor="06">65</hora>
							<hora valor="12">40</hora>
							<hora valor="18">65</hora>
							<hora valor="24">80</hora>
						</horas>
					</dato>
				</datos>
				<uvmax>4</uvmax>
			</dia>
			<dia fecha="2023-03-06">
				<periodos>
					<periodo intervalo="00-24">
						<precipitaciones>45</precipitaciones>
						<nieve>1500</nieve>
						<cielo estado="Intervalos nubosos">13</cielo>
						<viento>
							<direccion>NO</direccion>
							<velocidad>30</velocidad>
						</viento>
					</periodo>
					<periodo intervalo="00-12">
						<precipitaciones>30</precipitaciones>
						<cielo estado="Intervalos nubosos">13</cielo>
						<viento>
							<direccion>NO</direccion>
							<velocidad>30</velocidad>
						</viento>
					</periodo>
					<periodo intervalo="12-24">
						<precipitaciones>20</precipitaciones>
						<nieve>1500</nieve>
						<cielo estado="Muy nuboso">15</cielo>
						<viento>
							<direccion>NO</direccion>
							<velocidad>30</velocidad>
						</viento>
					</periodo>
					<periodo intervalo="00-06">
						<precipitaciones>30</precipitaciones>
						<nieve>1400</nieve>
						<cielo estado="Nuboso">14n</cielo>
						<viento>
							<direccion>O</direccion>
							<velocidad>10</velocidad>
						</viento>
					</periodo>
					<periodo intervalo="06-12">
						<precipitaciones>0</precipitaciones>
						<cielo estado="Poco nuboso">12</cielo>
						<viento>
							<direccion>NO</direccion>
							<velocidad>30</velocidad>
						</viento>
					</periodo>
					<periodo intervalo="12-18">
						<precipitaciones>0</precipitaciones>
						<cielo estado="Muy nuboso">15</cielo>
						<viento>
							<direccion>NO</direccion>
							<velocidad>20</velocidad>
						</viento>
					</periodo>
					<periodo intervalo="18-24">
						<precipitaciones>20</precipitaciones>
						<cielo estado="Nuboso">14n</cielo>
						<viento>
							<direccion>C</direccion>
							<velocidad>0</velocidad>
						</viento>
					</periodo>
				</periodos>
				<datos>
					<dato valor="temperatura">
						<max>22</max>
						<min>10</min>
						<horas>
							<hora valor="06">10</hora>
							<hora valor="12">20</hora>
							<hora valor="18">18</hora>
							<hora valor="24">14</hora>
						</horas>
					</dato>
					<dato valor="sens_termica">
						<max>22</max>
						<min>8</min>
						<horas>
							<hora valor="06">10</hora>
							<hora valor="12">20</hora>
							<hora valor="18">18</hora>
							<hora valor="24">14</hora>
						</horas>
					</dato>
					<dato valor="humedad_relativa">
						<max>85</max>
						<min>30</min>
						<horas>
							<hora valor="06">75</hora>
							<hora valor="12">35</hora>
							<hora valor="18">40</hora>
							<hora valor="24">60</hora>
						</horas>
					</dato>
				</datos>
				<uvmax>4</uvmax>
			</dia>
			<dia fecha="2023-03-07">
				<periodos>
					<periodo intervalo="00-24">
						<precipitaciones>45</precipitaciones>
						<cielo estado="Intervalos nubosos">13</cielo>
						<viento>
							<direccion>O</direccion>
							<velocidad>20</velocidad>
						</viento>
					</periodo>
					<periodo intervalo="00-12">
						<precipitaciones>45</precipitaciones>
						<cielo estado="Intervalos nubosos">13</cielo>
						<viento>
							<direccion>O</direccion>
							<velocidad>20</velocidad>
						</viento>
					</periodo>
					<periodo intervalo="12-24">
						<precipitaciones>5</precipitaciones>
						<cielo estado="Nubes altas">17</cielo>
						<viento>
							<direccion>O</direccion>
							<velocidad>20</velocidad>
						</viento>
					</periodo>
				</periodos>
				<datos>
					<dato valor="temperatura">
						<max>24</max>
						<min>11</min>
					</dato>
					<dato valor="sens_termica">
						<max>24</max>
						<min>11</min>
					</dato>
					<dato valor="humedad_relativa">
						<max>80</max>
						<min>25</min>
					</dato>
				</datos>
				<uvmax>4</uvmax>
			</dia>
			<dia fecha="2023-03-08">
				<periodos>
					<periodo intervalo="00-24">
						<precipitaciones>0</precipitaciones>
						<cielo estado="Nubes altas">17</cielo>
						<viento>
							<direccion>S</direccion>
							<velocidad>20</velocidad>
						</viento>
					</periodo>
					<periodo intervalo="00-12">
						<precipitaciones>0</precipitaciones>
						<cielo estado="Nubes altas">17</cielo>
						<viento>
							<direccion>S</direccion>
							<velocidad>20</velocidad>
						</viento>
					</periodo>
					<periodo intervalo="12-24">
						<precipitaciones>0</precipitaciones>
						<cielo estado="Nubes altas">17</cielo>
						<viento>
							<direccion>S</direccion>
							<velocidad>20</velocidad>
						</viento>
					</periodo>
				</periodos>
				<datos>
					<dato valor="temperatura">
						<max>24</max>
						<min>11</min>
					</dato>
					<dato valor="sens_termica">
						<max>24</max>
						<min>11</min>
					</dato>
					<dato valor="humedad_relativa">
						<max>65</max>
						<min>40</min>
					</dato>
				</datos>
				<uvmax>5</uvmax>
			</dia>
			<dia fecha="2023-03-09">
				<periodos>
					<periodo intervalo="">
						<precipitaciones>5</precipitaciones>
						<cielo estado="Poco nuboso">12</cielo>
						<viento>
							<direccion>O</direccion>
							<velocidad>25</velocidad>
						</viento>
					</periodo>
				</periodos>
				<datos>
					<dato valor="temperatura">
						<max>27</max>
						<min>15</min>
					</dato>
					<dato valor="sens_termica">
						<max>27</max>
						<min>15</min>
					</dato>
					<dato valor="humedad_relativa">
						<max>80</max>
						<min>30</min>
					</dato>
				</datos>
				<uvmax>5</uvmax>
			</dia>
			<dia fecha="2023-03-10">
				<periodos>
					<periodo intervalo="">
						<precipitaciones>0</precipitaciones>
						<cielo estado="Nubes altas">17</cielo>
						<viento>
							<direccion>S</direccion>
							<velocidad>15</velocidad>
						</viento>
					</periodo>
				</periodos>
				<datos>
					<dato valor="temperatura">
						<max>25</max>
						<min>14</min>
					</dato>
					<dato valor="sens_termica">
						<max>25</max>
						<min>14</min>
					</dato>
					<dato valor="humedad_relativa">
						<max>55</max>
						<min>30</min>
					</dato>
				</datos>
			</dia>
			<dia fecha="2023-03-11">
				<periodos>
					<periodo intervalo="">
						<precipitaciones>0</precipitaciones>
						<cielo estado="Nubes altas">17</cielo>
						<viento>
							<direccion>SO</direccion>
							<velocidad>5</velocidad>
						</viento>
					</periodo>
				</periodos>
				<datos>
					<dato valor="temperatura">
						<max>31</max>
						<min>15</min>
					</dato>
					<dato valor="sens_termica">
						<max>31</max>
						<min>15</min>
					</dato>
					<dato valor="humedad_relativa">
						<max>55</max>
						<min>20</min>
					</dato>
				</datos>
			</dia>
		</dias>
	</prediccion>
</predicciones>