<predicciones xmlns:xsi="http://www.w3.org/2001/XMLSchema-instance" xsi:noNamespaceSchemaLocation="tiempo.xsd">
	<prediccion>
		<realizada>2023-03-10T07:16:40</realizada>
		<ubicacion id="45168">
			<localidad>
				<nombre>Toledo</nombre>
				<provincia>Toledo</provincia>
			</localidad>
		</ubicacion>
		<dias>
			<dia fecha="2023-03-10">
				<periodos>
					<periodo intervalo="00-24">
						<precipitaciones>0</precipitaciones>
						<cielo estado="Poco nuboso">12</cielo>
						<viento>
							<direccion>O</direccion>
							<velocidad>25</velocidad>
						</viento>
					</periodo>
					<periodo intervalo="00-12">
						<precipitaciones>0</precipitaciones>
						<cielo estado="Nuboso">14</cielo>
						<viento>
							<direccion>O</direccion>
							<velocidad>25</velocidad>
						</viento>
					</periodo>
					<periodo intervalo="12-24">
						<precipitaciones>0</precipitaciones>
						<cielo estado="Poco nuboso">12</cielo>
						<viento>
							<direccion>O</direccion>
							<velocidad>25</velocidad>
						</viento>
					</periodo>
					<periodo intervalo="00-06">
						<precipitaciones>0</precipitaciones>
						<cielo estado="Nuboso">14n</cielo>
						<viento>
							<direccion>O</direccion>
							<velocidad>15</velocidad>
						</viento>
					</periodo>
					<periodo intervalo="06-12">
						<precipitaciones>0</precipitaciones>
						<cielo estado="Nuboso">14</cielo>
						<viento>
							<direccion>O</direccion>
							<velocidad>25</velocidad>
						</viento>
					</periodo>
					<periodo intervalo="12-18">
						<precipitaciones>0</precipitaciones>
						<cielo estado="Poco nuboso">12</cielo>
						<viento>
							<direccion>O</direccion>
							<velocidad>25</velocidad>
						</viento>
					</periodo>
					<periodo intervalo="18-24">
						<precipitaciones>0</precipitaciones>
						<cielo estado="Poco nuboso">12n</cielo>
						<viento>
							<direccion>O</direccion>
							<velocidad>15</velocidad>
						</viento>
					</periodo>
				</periodos>
				<datos>
					<dato valor="temperatura">
						<max>21</max>
						<min>10</min>
						<horas>
							<hora valor="06">10</hora>
							<hora valor="12">17</hora>
							<hora valor="18">17</hora>
							<hora valor="24">13</hora>
						</horas>
					</dato>
					<dato valor="sens_termica">
						<max>21</max>
						<min>10</min>
						<horas>
							<hora valor="06">10</hora>
							<hora valor="12">17</hora>
							<hora valor="18">17</hora>
							<hora valor="24">13</hora>
						</horas>
					</dato>
					<dato valor="humedad_relativa">
						<max>85</max>
						<min>35</min>
						<horas>
							<hora valor="06">85</hora>
							<hora valor="12">45</hora>
							<hora valor="18">50</hora>
							<hora valor="24">80</hora>
						</horas>
					</dato>
				</datos>
				<uvmax>5</uvmax>
			</dia>
			<dia fecha="2023-03-11">
				<periodos>
					<periodo intervalo="00-24">
						<precipitaciones>0</precipitaciones>
						<cielo estado="Muy nuboso">15</cielo>
						<viento>
							<direccion>O</direccion>
							<velocidad>20</velocidad>
						</viento>
					</periodo>
					<periodo intervalo="00-12">
						<precipitaciones>0</precipitaciones>
						<cielo estado="Muy nuboso">15</cielo>
						<viento>
							<direccion>O</direccion>
							<velocidad>20</velocidad>
						</viento>
					</periodo>
					<periodo intervalo="12-24">
						<precipitaciones>0</precipitaciones>
						<cielo estado="Nuboso">14</cielo>
						<viento>
							<direccion>O</direccion>
							<velocidad>20</velocidad>
						</viento>
					</periodo>
					<periodo intervalo="00-06">
						<precipitaciones>0</precipitaciones>
						<cielo estado="Muy nuboso">15n</cielo>
						<viento>
							<direccion>O</direccion>
							<velocidad>5</velocidad>
						</viento>
					</periodo>
					<periodo intervalo="06-12">
						<precipitaciones>0</precipitaciones>
						<cielo estado="Muy nuboso">15</cielo>
						<viento>
							<direccion>O</direccion>
							<velocidad>20</velocidad>
						</viento>
					</periodo>
					<periodo intervalo="12-18">
						<precipitaciones>0</precipitaciones>
						<cielo estado="Nuboso">14</cielo>
						<viento>
							<direccion>O</direccion>
							<velocidad>20</velocidad>
						</viento>
					</periodo>
					<periodo intervalo="18-24">
						<precipitaciones>0</precipitaciones>
						<cielo estado="Poco nuboso">12n</cielo>
						<viento>
							<direccion>O</direccion>
							<velocidad>5</velocidad>
						</viento>
					</periodo>
				</periodos>
				<datos>
					<dato valor="temperatura">
						<max>22</max>
						<min>11</min>
						<horas>
							<hora valor="06">10</hora>
							<hora valor="12">18</hora>
							<hora valor="18">18</hora>
							<hora valor="24">13</hora>
						</horas>
					</dato>
					<dato valor="sens_termica">
						<max>21</max>
						<min>10</min>
						<horas>
							<hora valor="06">10</hora>
							<hora valor="12">18</hora>
							<hora valor="18">18</hora>
							<hora valor="24">13</hora>
						</horas>
					</dato>
					<dato valor="humedad_relativa">
						<max>90</max>
						<min>45</min>
						<horas>
							<hora valor="06">90</hora>
							<hora valor="12">55</hora>
							<hora valor="18">50</hora>
							<hora valor="24">80</hora>
						</horas>
					</dato>
				</datos>
				<uvmax>5</uvmax>
			</dia>
			<dia fecha="2023-03-12">
				<periodos>
					<periodo intervalo="00-24">
						<precipitaciones>0</precipitaciones>
						<cielo estado="Nubes altas">17</cielo>
						<viento>
							<direccion>C</direccion>
							<velocidad>0</velocidad>
						</viento>
					</periodo>
					<periodo intervalo="00-12">
						<precipitaciones>0</precipitaciones>
						<cielo estado="Nubes altas">17</cielo>
						<viento>
							<direccion>SO</direccion>
							<velocidad>5</velocidad>
						</viento>
					</periodo>
					<periodo intervalo="12-24">
						<precipitaciones>0</precipitaciones>
						<cielo estado="Nubes altas">17</cielo>
						<viento>
							<direccion>O</direccion>
							<velocidad>10</velocidad>
						</viento>
					</periodo>
				</periodos>
				<datos>
					<dato valor="temperatura">
						<max>24</max>
						<min>9</min>
					</dato>
					<dato valor="sens_termica">
						<max>24</max>
						<min>9</min>
					</dato>
					<dato valor="humedad_relativa">
						<max>90</max>
						<min>40</min>
					</dato>
				</datos>
				<uvmax>6</uvmax>
			</dia>
			<dia fecha="2023-03-13">
				<periodos>
					<periodo intervalo="00-24">
						<precipitaciones>0</precipitaciones>
						<cielo estado="Poco nuboso">12</cielo>
						<viento>
							<direccion>O</direccion>
							<velocidad>15</velocidad>
						</viento>
					</periodo>
					<periodo intervalo="00-12">
						<precipitaciones>0</precipitaciones>
						<cielo estado="Poco nuboso">12</cielo>
						<viento>
							<direccion>O</direccion>
							<velocidad>15</velocidad>
						</viento>
					</periodo>
					<periodo intervalo="12-24">
						<precipitaciones>0</precipitaciones>
						<cielo estado="Despejado">11</cielo>
						<viento>
							<direccion>O</direccion>
							<velocidad>25</velocidad>
						</viento>
					</periodo>
				</periodos>
				<datos>
					<dato valor="temperatura">
						<max>24</max>
						<min>9</min>
					</dato>
					<dato valor="sens_termica">
						<max>24</max>
						<min>9</min>
					</dato>
					<dato valor="humedad_relativa">
						<max>75</max>
						<min>35</min>
					</dato>
				</datos>
				<uvmax>5</uvmax>
			</dia>
			<dia fecha="2023-03-14">
				<periodos>
					<periodo intervalo="">
						<precipitaciones>0</precipitaciones>
						<cielo estado="Poco nuboso">12</cielo>
						<viento>
							<direccion>O</direccion>
							<velocidad>10</velocidad>
						</viento>
					</periodo>
				</periodos>
				<datos>
					<dato valor="temperatura">
						<max>19</max>
						<min>7</min>
					</dato>
					<dato valor="sens_termica">
						<max>19</max>
						<min>7</min>
					</dato>
					<dato valor="humedad_relativa">
						<max>95</max>
						<min>40</min>
					</dato>
				</datos>
				<uvmax>5</uvmax>
			</dia>
			<dia fecha="2023-03-15">
				<periodos>
					<periodo intervalo="">
						<precipitaciones>0</precipitaciones>
						<cielo estado="Despejado">11</cielo>
						<viento>
							<direccion>NE</direccion>
							<velocidad>5</velocidad>
						</viento>
					</periodo>
				</periodos>
				<datos>
					<dato valor="temperatura">
						<max>23</max>
						<min>7</min>
					</dato>
					<dato valor="sens_termica">
						<max>23</max>
						<min>7</min>
					</dato>
					<dato valor="humedad_relativa">
						<max>80</max>
						<min>35</min>
					</dato>
				</datos>
			</dia>
			<dia fecha="2023-03-16">
				<periodos>
					<periodo intervalo="">
						<precipitaciones>5</precipitaciones>
						<cielo estado="Nubes altas">17</cielo>
						<viento>
							<direccion>O</direccion>
							<velocidad>5</velocidad>
						</viento>
					</periodo>
				</periodos>
				<datos>
					<dato valor="temperatura">
						<max>25</max>
						<min>9</min>
					</dato>
					<dato valor="sens_termica">
						<max>25</max>
						<min>9</min>
					</dato>
					<dato valor="humedad_relativa">
						<max>60</max>
						<min>25</min>
					</dato>
				</datos>
			</dia>
		</dias>
	</prediccion>
</predicciones>